{
  "schemaVersion": "1.0",
  "datasetId": "core-multi-workspace-v1",
  "kind": "multiWorkspace",
  "generatorVersion": "1.0",
  "seed": 130363,
  "counts": {"workspaces": 20, "specs": 1000, "statements": 1000, "relations": 20000},
  "shape": {"specBytes": 841432, "meanSpecBytes": {"numerator": 841432, "denominator": 1000}, "statementsPerSpec": {"numerator": 1000, "denominator": 1000}, "edgeDensity": {"numerator": 20000, "denominator": 999000}},
  "benchmark": {
    "contextRoot": "REQ-000001",
    "contextDocuments": 20,
    "contextWorkspaces": 3,
    "maxPresentationBytes": 131072
  },
  "expectedTreeDigest": "sha256:1626b4d08eb9a05e8cdeef71f125292dfc71495f175119c6f99bd76c5b837a54"
}
